{
  "resource": "session:ui-notify",
  "epoch": 1,
  "holder": {
    "runner_id": "rn-a3606d08f5354f37",
    "principal": "app:app2@alice",
    "host": "${FIXTURE_HOST}",
    "pid": 29203,
    "runtime_id": "rt-fixture-native"
  },
  "acquired_at_ms": 1792411645828,
  "released_at_ms": 1792411645871
}